{
  "build": "v2.3.1-state-enabled",
  "lastUpdated": "2025-10-31T16:17:11.822429Z",
  "guild": {
    "id": "1323266812024197140",
    "name": "Mewtwo Colosseum"
  },
  "channels": {
    "battleAnnouncements": "TBD_CHANNEL_ID",
    "battleLogs": "TBD_CHANNEL_ID",
    "battleArchive": "TBD_CHANNEL_ID"
  },
  "categories": {
    "privateBattles": "1323266812024197141"
  },
  "roles": {
    "winner": "TBD_ROLE_ID",
    "loser": "TBD_ROLE_ID",
    "owner": "TBD_ROLE_ID",
    "leagueDirector": "TBD_ROLE_ID",
    "ranks": {
      "S": "TBD_ROLE_ID",
      "Apex": "TBD_ROLE_ID",
      "A": "TBD_ROLE_ID",
      "B": "TBD_ROLE_ID",
      "C": "TBD_ROLE_ID",
      "D": "TBD_ROLE_ID",
      "E": "TBD_ROLE_ID"
    },
    "typesOrdered": [
      "TBD_TYPE_ROLE_ID_1",
      "TBD_TYPE_ROLE_ID_2",
      "TBD_TYPE_ROLE_ID_3"
    ]
  },
  "xp": {
    "winnerAwardRoleId": "TBD_ROLE_ID_OPTIONAL",
    "winnerXp": 0,
    "loserXpByRank": {
      "S": 5000,
      "Apex": 1000,
      "A": 4000,
      "B": 3000,
      "C": 2000,
      "D": 1500,
      "E": 1000
    },
    "loserFlatRoleId": "TBD_ROLE_ID",
    "loserFlatXp": 500
  },
  "permissions": {
    "canSetOrder": [
      "owner",
      "leagueDirector"
    ],
    "canSetResult": [
      "owner",
      "leagueDirector"
    ],
    "canRotateOrder": [
      "owner",
      "leagueDirector"
    ]
  },
  "behaviour": {
    "challengePrivateChannelTTLHours": 24,
    "autopingHoursBeforeClose": 12
  }
}